[
  {
    "timestamp": "2020-03-16T14:30:00Z",
    "symbol": "BTC/USDT",
    "price_open": 8800,
    "price_high": 9150,
    "price_low": 7800,
    "volume": 12500,
    "vix": 45.2,
    "system_state_before": "S1",
    "system_state_after": "S2",
    "fault_injection_flag": true
  },
  {
    "timestamp": "2021-05-19T09:15:00Z",
    "symbol": "ETH/USDT",
    "price_open": 3600,
    "price_high": 3850,
    "price_low": 3200,
    "volume": 9800,
    "vix": 38.7,
    "system_state_before": "S1",
    "system_state_after": "S3",
    "fault_injection_flag": false
  },
  {
    "timestamp": "2023-09-22T11:45:00Z",
    "symbol": "GC=F (Gold Futures)",
    "price_open": 1820,
    "price_high": 1950,
    "price_low": 1760,
    "volume": 8300,
    "vix": 30.1,
    "system_state_before": "S1",
    "system_state_after": "S2",
    "fault_injection_flag": true
  },
  {
    "timestamp": "2024-01-04T15:00:00Z",
    "symbol": "NQ=F (Nasdaq Futures)",
    "price_open": 13800,
    "price_high": 14150,
    "price_low": 13200,
    "volume": 15600,
    "vix": 27.4,
    "system_state_before": "S2",
    "system_state_after": "S3",
    "fault_injection_flag": false
  },
  {
    "timestamp": "2025-07-11T10:20:00Z",
    "symbol": "CL=F (Crude Oil Futures)",
    "price_open": 78,
    "price_high": 84,
    "price_low": 73,
    "volume": 6200,
    "vix": 52.9,
    "system_state_before": "S3",
    "system_state_after": "S1",
    "fault_injection_flag": true
  }
]